{
  "$schema": "https://opensource.adobe.com/spectrum-design-data/schemas/v0/field.schema.json",
  "specVersion": "1.0.0-draft",
  "name": "component",
  "description": "Component scope — the UI component this token belongs to (e.g. button, checkbox, slider).",
  "kind": "semantic",
  "registry": "packages/design-data/registry/components.json",
  "validation": "advisory",
  "serialization": {
    "position": 3
  },
  "scope": null,
  "required": false,
  "valueType": "string"
}
