{
  "$schema": "https://opensource.adobe.com/spectrum-design-data/schemas/v0/field.schema.json",
  "specVersion": "1.0.0-draft",
  "name": "qualifier",
  "description": "Behavioral or layout modifier that narrows a property/anatomy without being a state, variant, or position (e.g. stacked, multiline, precision, collapsed, expanded, drag, highlight).",
  "kind": "semantic",
  "registry": "packages/design-data/registry/qualifiers.json",
  "validation": "advisory",
  "serialization": {
    "position": 31
  },
  "scope": null,
  "required": false,
  "valueType": "string"
}
