{
  "$schema": "https://opensource.adobe.com/spectrum-design-data/schemas/v0/field.schema.json",
  "specVersion": "1.0.0-draft",
  "name": "anatomy",
  "description": "Visible named part of a component (e.g. handle, icon, label, track). Refers to a specific sub-element, not a styling surface.",
  "kind": "semantic",
  "registry": "packages/design-system-registry/registry/anatomy-terms.json",
  "validation": "advisory",
  "serialization": {
    "position": 4
  },
  "scope": null,
  "required": false,
  "valueType": "string"
}
