{
  "$schema": "https://opensource.adobe.com/spectrum-design-data/schemas/v0/field.schema.json",
  "specVersion": "1.0.0-draft",
  "name": "contrast",
  "description": "Contrast level mode set (e.g. regular, high). Drives cascade resolution.",
  "kind": "mode-set",
  "registry": null,
  "validation": "strict",
  "serialization": {
    "position": 22
  },
  "scope": null,
  "required": false,
  "valueType": "string",
  "excludeFromLegacyKey": true
}
