{
  "$schema": "https://opensource.adobe.com/spectrum-design-data/schemas/v0/field.schema.json",
  "specVersion": "1.0.0-draft",
  "name": "colorFamily",
  "description": "Hue family of a color token (e.g. blue, gray, celery, accent). Used on color palette and semantic color tokens. Paired with scaleIndex for ramp tokens (e.g. colorFamily=blue + scaleIndex=100 → blue-100).",
  "kind": "semantic",
  "registry": "packages/design-data/registry/color-families.json",
  "validation": "advisory",
  "serialization": {
    "position": 23
  },
  "scope": "color",
  "required": false,
  "valueType": "string",
  "excludeFromLegacyKey": true
}
